{
  "canonStatus": "canon",
  "collectionType": "tradePaperback",
  "collects": [
    "doctor-aphra-2020-01",
    "doctor-aphra-2020-26",
    "doctor-aphra-2020-28",
    "doctor-aphra-2020-29",
    "doctor-aphra-2020-30",
    "doctor-aphra-2020-31"
  ],
  "displayTitle": "Doctor Aphra Vol. 6: Ascendant",
  "slug": "c_doctor-aphra-vol-6-ascendant_651",
  "title": "Doctor Aphra Vol. 6: Ascendant"
}
