{
  "canonStatus": "non-canon",
  "collectionType": "tradePaperback",
  "collects": [
    "dark-empire-ii-1994-1",
    "dark-empire-ii-1994-2",
    "dark-empire-ii-1994-3",
    "dark-empire-ii-1994-4",
    "dark-empire-ii-1994-5",
    "dark-empire-ii-1994-6",
    "empire-s-end-1995-1",
    "empire-s-end-2-rage-of-the-emperor"
  ],
  "displayTitle": "Dark Empire II 2nd Edition",
  "slug": "c_dark-empire-ii-2nd-edition_903",
  "title": "Dark Empire II 2nd Edition"
}
