{
  "canonStatus": "canon",
  "collectionType": "tradePaperback",
  "collects": [
    "obi-wan-1",
    "obi-wan-2",
    "obi-wan-3",
    "obi-wan-4",
    "obi-wan-5"
  ],
  "displayTitle": "Obi-Wan: A Jedi's Purpose",
  "era": "reignOfTheEmpire",
  "releaseDate": "2022-12-13T00:00:00.000Z",
  "slug": "c_obi-wan-a-jedi-s-purpose_106",
  "synopsis": "Fast approaches the ultimate destiny of one of the Jedi’s most renowned masters! As he spends his final days in the remote deserts of Tatooine, Obi-Wan Kenobi takes time to reflect on – and record – key moments of a heroic life long-lived. Writing in old leather-bound journals from his hermit’s hut, Obi-Wan remembers his days as a young Jedi Initiate, his trials as a Padawan, the crucible of Jedi Knighthood and the Clone Wars, and some of the earliest challenges he faced as a true Master of the Force! In this tale, Obi-Wan considers a watershed Youngling adventure he narrowly survived on Coruscant when he was but eight years of age…This is just the beginning of his Jedi journey!",
  "title": "Obi-Wan: A Jedi's Purpose"
}
