{
  "canonStatus": "non-canon",
  "collectionType": "tradePaperback",
  "collects": [
    "classic-star-wars-01-the-bounty-hunter-of-ord-mantell",
    "classic-star-wars-02-darth-vader-strikes",
    "classic-star-wars-03-darth-vader-strikes-pt-2",
    "classic-star-wars-04-the-serpent-masters",
    "classic-star-wars-05-the-serpent-masters-pt-2",
    "classic-star-wars-06-deadly-reunion",
    "classic-star-wars-07-traitor-s-gambit"
  ],
  "displayTitle": "Classic Star Wars Volume 1: In Deadly Pursuit",
  "releaseDate": "1994-06-01T00:00:00.000Z",
  "slug": "c_classic-star-wars-volume-1-in-deadly-pursuit_224",
  "title": "Classic Star Wars Volume 1: In Deadly Pursuit"
}
