{
  "canonStatus": "non-canon",
  "collectionType": "hardcover",
  "collects": [
    "darth-vader-and-the-cry-of-shadows-1",
    "darth-vader-and-the-cry-of-shadows-2",
    "darth-vader-and-the-cry-of-shadows-3",
    "darth-vader-and-the-cry-of-shadows-4",
    "darth-vader-and-the-cry-of-shadows-5"
  ],
  "displayTitle": "Darth Vader and the Cry of Shadows",
  "slug": "c_darth-vader-and-the-cry-of-shadows_833",
  "title": "Darth Vader and the Cry of Shadows"
}
