{
  "canonStatus": "non-canon",
  "collectionType": "omnibus",
  "collects": [
    "galaxy-of-fear-1997-1",
    "star-wars-droids-1-the-destroyer",
    "star-wars-droids-2-the-ultimate-weapon",
    "star-wars-droids-3-the-scarlet-pirate",
    "star-wars-droids-4-lost-in-time",
    "star-wars-droids-5-separated",
    "star-wars-droids-6-star-wars-according-to-the-droids-book",
    "star-wars-droids-season-of-revolt-1995-3",
    "star-wars-droids-season-of-revolt-1995-4"
  ],
  "displayTitle": "Legends Epic Collection: The Empire Vol. 5",
  "slug": "c_star-wars-legends-epic-collection-the-empire-vol-5_716",
  "synopsis": "Collects Star Wars: Droids (1994) Special and #1-6 (AKA The Kalarba Adventures #1-6); material from Star Wars Galaxy Magazine #1 (between Kalarba 5-6); Star Wars: Droids (1995) #1-8 (“Rebellion” and “Season of Revolt”); Droids: The Protocol Offensive OGN; and material from Star Wars Tales #16 & 20.",
  "title": "Star Wars Legends Epic Collection: The Empire Vol. 5"
}
