{
  "canonStatus": "canon",
  "collectionType": "tradePaperback",
  "collects": [
    "doctor-aphra-10-the-enormous-profit-part-ii",
    "doctor-aphra-11-the-enormous-profit-part-iii",
    "doctor-aphra-12-the-enormous-profit-part-iv",
    "doctor-aphra-13-the-enormous-profit-part",
    "doctor-aphra-9-the-enormous-profit-part",
    "doctor-aphra-annual-1"
  ],
  "displayTitle": "Doctor Aphra (2016) Vol. 2: Doctor Aphra and the Enormous Profit",
  "era": "ageOfRebellion",
  "releaseDate": "2018-02-06T00:00:00.000Z",
  "slug": "c_doctor-aphra-2016-vol-2-doctor-aphra-and-the-enormous-profit_54",
  "synopsis": "We’ve seen Chelli Aphra take on some wild adventures by the horns and come out of it alive (barely). The question now is how will she escape a deadly and sentient crystal gone rogue during her attempt to sell it to the highest bidder at her very own auction party? And in the midst of the chaos, a surprise visitor decides to join the fray. I guess that’s what Doctor Aphra gets for being greedy.",
  "title": "Doctor Aphra (2016) Vol. 2: Doctor Aphra and the Enormous Profit"
}
