{
  "canonStatus": "non-canon",
  "collectionType": "tradePaperback",
  "collects": [
    "jedi-vs-sith-1",
    "jedi-vs-sith-2",
    "jedi-vs-sith-3",
    "jedi-vs-sith-4",
    "jedi-vs-sith-5",
    "jedi-vs-sith-6",
    "knight-errant-aflame-2010-1",
    "knight-errant-aflame-2010-2",
    "knight-errant-aflame-2010-3",
    "knight-errant-aflame-2010-4",
    "knight-errant-aflame-2010-5",
    "knight-errant-deluge-2011-1",
    "knight-errant-deluge-2011-2",
    "knight-errant-deluge-2011-3",
    "knight-errant-deluge-2011-4",
    "knight-errant-deluge-2011-5",
    "knight-errant-escape-2012-1",
    "knight-errant-escape-2012-2",
    "knight-errant-escape-2012-3",
    "knight-errant-escape-2012-4",
    "knight-errant-escape-2012-5"
  ],
  "displayTitle": "Legends Epic Collection: The Old Republic Vol. 5",
  "releaseDate": "2023-03-14T00:00:00.000Z",
  "slug": "c_legends-epic-collection-the-old-republic-vol-5_331",
  "title": "Legends Epic Collection: The Old Republic Vol. 5"
}
