{
  "canonStatus": "non-canon",
  "collectionType": "omnibus",
  "collects": [
    "the-rebel-opposition-1",
    "the-rebel-opposition-2",
    "the-rebel-opposition-3",
    "the-rebel-opposition-4",
    "x-wing-rogue-leader-2005-1",
    "x-wing-rogue-leader-2005-2",
    "x-wing-rogue-leader-2005-3",
    "x-wing-rogue-squadron-05-the-phantom-affair-part-1",
    "x-wing-rogue-squadron-06-the-phantom-affair-part-2",
    "x-wing-rogue-squadron-07-the-phantom-affair-part-3",
    "x-wing-rogue-squadron-08-the-phantom-affair-part-4",
    "x-wing-rogue-squadron-10-battleground-tatooine-part-2",
    "x-wing-rogue-squadron-11-battleground-tatooine-part-3",
    "x-wing-rogue-squadron-12-battleground-tatooine-part-4",
    "x-wing-rogue-squadron-13-the-warrior-princess-part-1",
    "x-wing-rogue-squadron-14-the-warrior-princess-part-2",
    "x-wing-rogue-squadron-15-the-warrior-princess-part-3",
    "x-wing-rogue-squadron-16-the-warrior-princess-part-4",
    "x-wing-rogue-squadron-9-battleground-tatooine-part-1"
  ],
  "displayTitle": "Legends Epic Collection: The New Republic Vol. 2",
  "slug": "c_star-wars-legends-epic-collection-the-new-republic-vol-2_737",
  "synopsis": "Collects Star Wars: X-Wing Rogue Leader #1-3; Star Wars: X-Wing Rogue Squadron #1-16 & Special; and material from Star Wars Tales #12 & 23",
  "title": "Star Wars Legends Epic Collection: The New Republic Vol. 2"
}
