{
  "canonStatus": "non-canon",
  "collectionType": "omnibus",
  "collects": [
    "mara-jade-by-the-emperor-s-hand-1998-0",
    "mara-jade-by-the-emperor-s-hand-1998-1",
    "mara-jade-by-the-emperor-s-hand-1998-3",
    "mara-jade-by-the-emperor-s-hand-1998-4",
    "mara-jade-by-the-emperor-s-hand-1998-5",
    "mara-jade-by-the-emperor-s-hand-1998-6",
    "mara-jade-by-the-emperor-s-hand-2",
    "shadows-of-the-empire-1",
    "shadows-of-the-empire-2",
    "shadows-of-the-empire-3",
    "shadows-of-the-empire-4",
    "shadows-of-the-empire-5",
    "shadows-of-the-empire-6",
    "shadows-of-the-empire-evolution-1998-1",
    "shadows-of-the-empire-evolution-1998-2",
    "shadows-of-the-empire-evolution-1998-3",
    "shadows-of-the-empire-evolution-1998-4",
    "shadows-of-the-empire-evolution-1998-5"
  ],
  "displayTitle": "Omnibus: Shadows of the Empire",
  "releaseDate": "2010-01-27T00:00:00.000Z",
  "slug": "c_omnibus-shadows-of-the-empire_379",
  "title": "Omnibus: Shadows of the Empire"
}
