{
  "canonStatus": "non-canon",
  "collectionType": "tradePaperback",
  "collects": [
    "tales-of-the-jedi-1-ulic-qel-droma-and-the-beast-wars-of-onderon-part-1"
  ],
  "displayTitle": "Legends Epic Collection: Tales of the Jedi Vol. 1",
  "releaseDate": "2020-12-08T00:00:00.000Z",
  "slug": "c_legends-epic-collection-tales-of-the-jedi-vol-1_298",
  "title": "Legends Epic Collection: Tales of the Jedi Vol. 1"
}
