{
  "canonStatus": "canon",
  "collectionType": "tradePaperback",
  "collects": [
    "star-wars-tales-from-the-nightlands-1",
    "star-wars-tales-from-the-nightlands-2",
    "star-wars-tales-from-the-nightlands-3"
  ],
  "displayTitle": "Tales From the Nightlands",
  "releaseDate": "2026-03-17T00:00:00.000Z",
  "slug": "c_tales-from-the-nightlands_162",
  "synopsis": "Tales From the Nightlands is a collection of all 3 issues from the Nightlands mini series\nCavan Scott, Star Wars master of the macabre, conjures an all-new Halloween special from a galaxy far, far away in this original graphic novel. Contained herein is a trio of terrifying tales that span the Skywalker saga!\nOn the planet Ryloth, Twi’leks speak in hushed tones about the Nightlands, the spectral realm where their spirits retire after death. According to legend, there are certain nights when the veil between that haunted place and the land of the living is so thin that one can communicate with the other side.\nIt was on one such night that young Padawan Anakin Skywalker, while visiting Ryloth with Master Obi-Wan Kenobi, attempted to summon the ghost of Qui-Gon Jinn for a final goodbye. But when Anakin made contact with the Nightlands, it wasn’t his old friend who answered…\nEnter: The Nightlander, a Star Wars boogeyman who seeks to possess a powerful, living host and bring despair to the galaxy!\nIn this terrifying new tale, three generations of galactic heroes contend with the malevolent Nightlander, else it escapes its frightful dimension to torment the waking world. Watch in horror as Anakin, Luke, Leia, and Rey face off against a dark power unlike any in the galaxy!\nCollecting: Tales From the Nightlands #1-3",
  "title": "Tales From the Nightlands"
}
