{
  "canonStatus": "canon",
  "collectionType": "tradePaperback",
  "collects": [
    "revelations-1"
  ],
  "displayTitle": "Jango Fett",
  "slug": "c_star-wars-jango-fett_666",
  "synopsis": "collects a story from Star Wars: Revelations (2023) #1. This series is actually set slightly prior to the prequels, since it deals with a pre-cloning Jango Fett.",
  "title": "Star Wars: Jango Fett"
}
