{
  "canonStatus": "non-canon",
  "collectionType": "tradePaperback",
  "collects": [
    "darth-maul-death-sentence-2012-1",
    "darth-maul-death-sentence-2012-2",
    "darth-maul-death-sentence-2012-3",
    "darth-maul-death-sentence-2012-4",
    "republic-1999-56",
    "republic-1999-61",
    "republic-1999-64",
    "republic-1999-66",
    "republic-55-the-battle-of-jabiim-part-1",
    "republic-57-the-battle-of-jabiim-part-3",
    "republic-58-the-battle-of-jabiim-part-4",
    "republic-59-enemy-lines",
    "republic-60-hate-and-fear",
    "republic-62-no-man-s-land",
    "republic-63-striking-from-the-shadows",
    "republic-65-show-of-force-part-1",
    "republic-67-forever-young"
  ],
  "displayTitle": "Legends Epic Collection: The Clone Wars Vol. 2",
  "releaseDate": "2018-04-03T00:00:00.000Z",
  "slug": "c_legends-epic-collection-the-clone-wars-vol-2_302",
  "title": "Legends Epic Collection: The Clone Wars Vol. 2"
}
