{
  "canonStatus": "non-canon",
  "collectionType": "tradePaperback",
  "collects": [
    "dark-times-a-spark-remains-1",
    "dark-times-a-spark-remains-2",
    "dark-times-a-spark-remains-3",
    "dark-times-a-spark-remains-4",
    "dark-times-a-spark-remains-5"
  ],
  "displayTitle": "Dark Times Volume 7: A Spark Remains",
  "releaseDate": "2013-11-18T00:00:00.000Z",
  "slug": "c_dark-times-volume-7-a-spark-remains_251",
  "title": "Dark Times Volume 7: A Spark Remains"
}
