{
  "canonStatus": "non-canon",
  "collectionType": "tradePaperback",
  "collects": [
    "dark-times-06-parallels-part-1",
    "dark-times-07-parallels-part-2",
    "dark-times-08-parallels-part-3",
    "dark-times-09-parallels-part-4",
    "dark-times-10-parallels-part-5",
    "dark-times-11-vector-part-5",
    "dark-times-12-vector-part-6",
    "dark-times-13-blue-harvest-part-1",
    "dark-times-14-blue-harvest-part-2",
    "dark-times-15-blue-harvest-part-3",
    "dark-times-16-blue-harvest-part-4",
    "dark-times-17-blue-harvest-part-5",
    "dark-times-out-of-the-wilderness-1",
    "dark-times-out-of-the-wilderness-2",
    "dark-times-out-of-the-wilderness-3",
    "dark-times-out-of-the-wilderness-4",
    "dark-times-out-of-the-wilderness-5"
  ],
  "displayTitle": "Legends Epic Collection: The Empire Vol. 2",
  "releaseDate": "2015-11-03T00:00:00.000Z",
  "slug": "c_legends-epic-collection-the-empire-vol-2_306",
  "title": "Legends Epic Collection: The Empire Vol. 2"
}
