{
  "canonStatus": "canon",
  "collectionType": "hardcover",
  "collects": [
    "bounty-hunters-18",
    "bounty-hunters-19",
    "bounty-hunters-20",
    "bounty-hunters-21",
    "bounty-hunters-22",
    "bounty-hunters-23",
    "bounty-hunters-24",
    "crimson-reign-1",
    "crimson-reign-2",
    "crimson-reign-3",
    "crimson-reign-4",
    "crimson-reign-5"
  ],
  "displayTitle": "Crimson Reign",
  "slug": "c_star-wars-crimson-reign_668",
  "synopsis": "collects Star Wars: Crimson Reign (2021) #1-5, Star Wars (2020) #19-25, Star Wars: Bounty Hunters (2020) #18-24, Star Wars: Darth Vader (2020) #18-24, and Star Wars: Doctor Aphra (2020) #16-21.",
  "title": "Star Wars: Crimson Reign"
}
